{"id":"compound.crafting_loop","name":"Crafting Loop","version":"0.1.0","description":"A crafting recipe validates ingredients through inventory state, emits a crafted-item result, displays feedback, and persists the changed inventory.","targetPlatform":"roblox","components":[{"id":"inventory.core_inventory","role":"authoritative ingredient and result store","config":{"maxSlots":50}},{"id":"inventory.slotted_bag","role":"player inventory presentation","config":{"slotCount":20}},{"id":"inventory.crafting_bench","role":"recipe processor","config":{"recipes":[]}},{"id":"ui.notification_toast","role":"craft success/failure feedback","config":{}},{"id":"persistence.save_system","role":"durable inventory snapshot","config":{"autosaveIntervalSeconds":120}}],"connections":[{"from":"inventory.core_inventory","event":"inventory.itemAdded","to":"inventory.crafting_bench"},{"from":"inventory.crafting_bench","event":"inventory.itemCrafted","to":"persistence.save_system"},{"from":"inventory.crafting_bench","event":"inventory.itemCrafted","to":"ui.notification_toast"}],"criticalComponents":["inventory.core_inventory","inventory.crafting_bench","persistence.save_system"],"acceptanceCriteria":["Crafting succeeds only when required ingredients exist.","A successful craft updates the authoritative inventory.","A successful craft is shown to the player and queued for persistence.","A crafted result remains after the player returns."]}
