{
  "id":"compound.party_quest_sharing_loop","name":"Party Quest Sharing Loop","version":"0.2.0","description":"Quest completion enters party credit policy; shared credit is deduplicated by a guard before the quest log receives a safe one-time credit signal.","targetPlatform":"roblox",
  "components":[{"id":"social.party_system","role":"party membership and shared-credit coordinator","config":{"maxMembers":4}},{"id":"social.party_credit_guard","role":"deduplication and safe-credit bridge","config":{"deduplicationWindowSeconds":300}},{"id":"progression.quest_log","role":"per-player objective and completion state","config":{"maxActiveQuests":5}},{"id":"persistence.save_system","role":"durable per-player quest state","config":{"autosaveIntervalSeconds":120}}],
  "connections":[{"from":"progression.quest_log","event":"progression.questCompleted","to":"social.party_system"},{"from":"social.party_system","event":"social.sharedQuestCredit","to":"social.party_credit_guard"},{"from":"social.party_credit_guard","event":"progression.sharedQuestCreditSafe","to":"progression.quest_log"}],
  "criticalComponents":["social.party_system","social.party_credit_guard","progression.quest_log","persistence.save_system"],"acceptanceCriteria":["Shared credit is deduplicated by party, player, quest, and credit key.","A safe shared-credit signal cannot recursively re-complete the same quest.","Quest state remains persisted per player."]
}
