{
  "id": "compound.adventure_interface_shell",
  "name": "Adventure Interface Shell",
  "version": "0.1.0",
  "description": "A responsive game-interface composition: a router owns screen navigation, style presets provide the visual language, safe-area layout supplies bounded regions, and dedicated sections present title, pause, settings, HUD, objectives, interaction prompts, tooltips, and quick selection. Gameplay systems retain authority for saves, quests, interactions, items, and abilities.",
  "targetPlatform": "agnostic",
  "components": [
    {"id": "ui.interface_router", "role": "screen stack and route lifecycle", "config": {"initialRoute": "title", "transitionSeconds": 0.24}},
    {"id": "presentation.color_palette", "role": "shared interface and world palette"},
    {"id": "presentation.style_presets", "role": "named visual theme and interface chrome", "config": {"presetName": "cartoon"}},
    {"id": "ui.safe_area_layout", "role": "responsive bounded layout regions", "config": {"compactBreakpointPx": 640, "minimumTouchTargetPx": 44}},
    {"id": "ui.title_screen", "role": "new game, continue, settings, and quit presentation", "config": {"showQuit": true}},
    {"id": "ui.pause_menu", "role": "modal pause actions and destructive-action confirmation", "config": {"confirmDestructiveActions": true}},
    {"id": "ui.settings_panel", "role": "draft audio, display, control, and accessibility preferences", "config": {"applyMode": "explicit"}},
    {"id": "ui.hud", "role": "health, currency, and world-space status projection", "config": {"showHealth": true, "showCurrency": true}},
    {"id": "progression.quest_log", "role": "quest and objective authority", "config": {"maxActiveQuests": 5}},
    {"id": "ui.quest_tracker", "role": "compact pinned-objective projection", "config": {"maxTrackedQuests": 3, "allowPinning": true}},
    {"id": "world.hotspot_layer", "role": "world interaction focus and accepted verbs"},
    {"id": "ui.interaction_prompt", "role": "contextual verb, input glyph, and hold-progress presentation", "config": {"placement": "bottomCenter"}},
    {"id": "ui.tooltip_layer", "role": "viewport-aware detail overlay", "config": {"hoverDelayMs": 350, "allowPinning": true}},
    {"id": "ui.quick_select_wheel", "role": "radial slot focus and selection requests", "config": {"selectionMode": "hold", "directionDeadzone": 0.25}},
    {"id": "ui.notification_toast", "role": "queued objective and system feedback", "config": {"maxVisible": 3, "displaySeconds": 4}},
    {"id": "persistence.save_system", "role": "durable applied settings", "config": {"autosaveIntervalSeconds": 120}}
  ],
  "connections": [
    {"from": "presentation.color_palette", "event": "presentation.paletteChanged", "to": "presentation.style_presets", "note": "Palette changes resolve through the active named style."},
    {"from": "presentation.color_palette", "event": "presentation.paletteChanged", "to": "ui.interface_router", "note": "Loaded views receive the router's theme lifecycle."},
    {"from": "presentation.style_presets", "event": "presentation.styleApplied", "to": "ui.title_screen"},
    {"from": "presentation.style_presets", "event": "presentation.styleApplied", "to": "ui.pause_menu"},
    {"from": "presentation.style_presets", "event": "presentation.styleApplied", "to": "ui.settings_panel"},
    {"from": "presentation.style_presets", "event": "presentation.styleApplied", "to": "ui.quest_tracker"},
    {"from": "presentation.style_presets", "event": "presentation.styleApplied", "to": "ui.interaction_prompt"},
    {"from": "presentation.style_presets", "event": "presentation.styleApplied", "to": "ui.tooltip_layer"},
    {"from": "presentation.style_presets", "event": "presentation.styleApplied", "to": "ui.quick_select_wheel"},
    {"from": "ui.safe_area_layout", "event": "ui.layoutChanged", "to": "ui.title_screen"},
    {"from": "ui.safe_area_layout", "event": "ui.layoutChanged", "to": "ui.pause_menu"},
    {"from": "ui.safe_area_layout", "event": "ui.layoutChanged", "to": "ui.settings_panel"},
    {"from": "ui.safe_area_layout", "event": "ui.layoutChanged", "to": "ui.quest_tracker"},
    {"from": "ui.safe_area_layout", "event": "ui.layoutChanged", "to": "ui.interaction_prompt"},
    {"from": "ui.safe_area_layout", "event": "ui.layoutChanged", "to": "ui.tooltip_layer"},
    {"from": "ui.safe_area_layout", "event": "ui.layoutChanged", "to": "ui.quick_select_wheel"},
    {"from": "ui.interface_router", "event": "ui.routeChanged", "to": "ui.title_screen"},
    {"from": "ui.interface_router", "event": "ui.routeChanged", "to": "ui.pause_menu"},
    {"from": "ui.interface_router", "event": "ui.routeChanged", "to": "ui.settings_panel"},
    {"from": "ui.interface_router", "event": "ui.routeChanged", "to": "ui.quest_tracker"},
    {"from": "ui.interface_router", "event": "ui.routeChanged", "to": "ui.interaction_prompt"},
    {"from": "ui.interface_router", "event": "ui.routeChanged", "to": "ui.tooltip_layer", "note": "Navigation dismisses stale detail overlays."},
    {"from": "ui.interface_router", "event": "ui.routeChanged", "to": "ui.quick_select_wheel", "note": "Navigation closes the wheel without confirming a selection."},
    {"from": "progression.quest_log", "event": "progression.questStarted", "to": "ui.quest_tracker"},
    {"from": "progression.quest_log", "event": "progression.objectiveUpdated", "to": "ui.quest_tracker"},
    {"from": "progression.quest_log", "event": "progression.questReady", "to": "ui.quest_tracker"},
    {"from": "progression.quest_log", "event": "progression.questCompleted", "to": "ui.quest_tracker"},
    {"from": "progression.quest_log", "event": "progression.questReady", "to": "ui.notification_toast"},
    {"from": "progression.quest_log", "event": "progression.questCompleted", "to": "ui.notification_toast"},
    {"from": "world.hotspot_layer", "event": "world.hotspotEntered", "to": "ui.interaction_prompt"},
    {"from": "world.hotspot_layer", "event": "world.hotspotExhausted", "to": "ui.interaction_prompt"},
    {"from": "world.hotspot_layer", "event": "world.hotspotRefused", "to": "ui.interaction_prompt"},
    {"from": "ui.settings_panel", "event": "ui.settingsApplied", "to": "persistence.save_system", "note": "Only explicitly applied settings request persistence; draft slider movement does not autosave."}
  ],
  "criticalComponents": [
    "ui.interface_router",
    "presentation.style_presets",
    "ui.safe_area_layout",
    "ui.title_screen",
    "ui.pause_menu",
    "ui.settings_panel",
    "ui.quest_tracker",
    "ui.interaction_prompt",
    "ui.tooltip_layer",
    "ui.quick_select_wheel"
  ],
  "acceptanceCriteria": [
    "Route changes produce mutually consistent full-screen sections; title and pause actions remain requests to the session or router API rather than directly mutating gameplay.",
    "Every interactive region remains inside device safe-area insets, compact layouts preserve reachable actions, and touch targets do not fall below the configured minimum.",
    "Theme changes reach every added shell section without any section owning a second palette or interface-style authority; the existing HUD can consume the resolved style through its host API.",
    "Settings edit a draft, emit normalized changes, and request persistence only when explicitly applied; subsystem owners remain responsible for applying values.",
    "Quest tracking is a read-only projection of progression.quest_log and cannot accept, advance, complete, or reward a quest.",
    "Interaction prompts communicate target, verb, availability, input glyph, and hold progress but never execute the interaction.",
    "Tooltips remain within the viewport, quick selection emits at most one selection request per confirmation, and route changes dismiss both without gameplay side effects.",
    "Keyboard, gamepad, pointer, and touch presentations expose equivalent actions; disabled and selected states are not communicated by color alone."
  ]
}
